{
  "active_offices": [
    "notary.assistant",
    "concierge.assistant",
    "courier.assistant",
    "monitor.assistant"
  ],
  "created_at": "2026-04-22T00:00:00Z",
  "evidence_refs": [
    "generated/multi_office_train_clean_flow/release_train.json"
  ],
  "id": "office_mesh_dashboard_v1_example",
  "kind": "office_mesh_dashboard_v1",
  "metrics": {
    "handoff_health": 0.99,
    "incident_count": 0,
    "scope_fidelity": 0.98
  },
  "notes": "Example artifact for office_mesh_dashboard_v1.",
  "owner_repo": "Agents-of-Abyss",
  "status": "draft",
  "version": "1.1.0"
}